{
  "extensions": {},
  "extensions_required": [],
  "extensions_used": [],
  "format_version": 1,
  "materials": {
    "StaticSurface": {
      "base_color": "blendlib_ecosystem_example:textures/blendlib/items/example_item__surface.png",
      "double_sided": false,
      "emissive": false,
      "mode": "opaque"
    }
  },
  "mesh": "blendlib_ecosystem_example:models3d/items/example_item.glb",
  "profile": "blendlib:rigid_v1",
  "units_per_block": 1.0
}
