{
  "extensions": {},
  "extensions_required": [],
  "extensions_used": [],
  "format_version": 1,
  "materials": {
    "StaticSurface": {
      "base_color": "blendlib_showcase:textures/blendlib/fixtures_static_model__staticsurface.png",
      "double_sided": false,
      "emissive": false,
      "mode": "opaque"
    }
  },
  "mesh": "blendlib_showcase:models3d/fixtures/static_model.glb",
  "profile": "blendlib:rigid_v1",
  "units_per_block": 1.0
}
