{
  "animation": {
    "initial_state": "blendlib_rules:idle",
    "states": {
      "blendlib_rules:attack": {
        "blend_seconds": 0.123456789123456,
        "clip": "Attack",
        "events": [
          {
            "event": "blendlib_rules:impact",
            "time_seconds": 0.5
          }
        ],
        "loop": false,
        "next": "blendlib_rules:idle",
        "speed": 1.0
      },
      "blendlib_rules:idle": {
        "clip": "Idle",
        "loop": true,
        "speed": 1.0
      },
      "blendlib_rules:run": {
        "clip": "Run",
        "events": [
          {
            "event": "blendlib_rules:footstep",
            "time_seconds": 0.5
          }
        ],
        "loop": true,
        "speed": 1.0
      },
      "blendlib_rules:walk": {
        "clip": "Walk",
        "events": [
          {
            "event": "blendlib_rules:footstep",
            "time_seconds": 0.5
          }
        ],
        "loop": true,
        "speed": 1.0
      }
    }
  },
  "extensions": {},
  "extensions_required": [],
  "extensions_used": [],
  "format_version": 1,
  "materials": {
    "BodyMaterial": {
      "base_color": "blendlib_rules:textures/blendlib/actor__bodymaterial.png",
      "double_sided": false,
      "emissive": false,
      "mode": "opaque"
    }
  },
  "mesh": "blendlib_rules:models3d/actor.glb",
  "profile": "blendlib:rigid_v1",
  "sockets": {
    "blendlib_rules:hand": {
      "node": "Root/Hand"
    }
  },
  "units_per_block": 1.0
}
